Title,Tag
"“Batman: More Than a Meme Token, a Community of Crypto Champions 🦇",h2
"In this amazing world of cryptocurrencies, Batman stands not just as a meme token but as a beacon of community strength and empowerment…",h3
What is Web 3.0? How Web3 Works? — A Guide for Beginners,h2
This blog is a comprehensive guide for beginners to understand the basics of Web 3.0 and how it works. Learn from the best and implement.,h3
Claim Your Free Chainlink $LINK Airdrops: Join the Revolution!,h2
"Want to get this Chainlink $LINK Airdrop through DappRadar? If so, you’re in the right place. As the popularity of airdrops continues to…",h3
Community Call — Let’s build the Supervillains together!,h2
"Lucas, Co-founder of Supervillain Labs, outlines his vision with the new venture and its connection to the entertainment shift",h3
Dymension $DYM Airdrop — Massive Airdrop is now Live!,h2
Run,h2
Update your VPS by executing the following command,h3
Chavinci Network,h2
A Layer 1 Ecosystem created to bring Blockchain Technology to the End-User,h3
Solidity Vs. Rust: Which Programming Language Should You Choose For Web3 Apps?,h2
"In today’s tech landscape, one cannot overlook the importance of blockchain technology. Because of its growing popularity and practicality…",h3
DAOs in Action: Case Studies of Successful Decentralized Governance,h2
"As the previous blog explained “What are DAOs?”, ”How Do DAOs Operate?”, “Benefits”, “Getting Involved” [link to the previous blog]",h3
SoDark Values!,h2
Here is a complete explanation about the SoDark project.,h3
"Grants Program Update, January 2024",h2
A monthly status update for Sia Grants Program proposals.,h3
Bitcoin: The End Of An Era (Documentary),h2
Where Will Bitcoin (BTC) Stop Once And For All,h3
Beam $BEAM Airdrop: How to claim 150$ easy?,h2
Announcing OEV Network: The ZK-rollup to capture all oracle extractable value,h2
OEV Network is an onchain solution for every dApp on every chain to recapture MEV related to oracle updates.,h3
Multibit $MUBI Airdrop Going Now — How to claim Tutorial,h2
All Major Blockchain Consensus Algorithms Explained,h2
Understanding the Different Types of Blockchain Consensus Mechanisms,h3
Fantom $FTM Airdrop — Massive Airdrop is now Live!,h2
SlashProof Testnet Live on Karak,h2
"The future is restaked, and secured by SlashProof",h3
"How to build ideal Government with AI, Blockchain, Distributed computing",h2
"In this article, I want to tell about ideal management of a state using 100% digitalization and automation of processes",h3
Aleph.im ultimate F.A.Q,h2
"Frequently Asked Questions about aleph.im, for stakers, node operators and liquidity providers.",h3
Unleash Your Inner Architect: Building the Future with the Syntropy Builder Program,h2
"The internet we know faces challenges: centralized bottlenecks, lagging speeds, and ever-present security concerns. But what if there was a…",h3
MELD Dev Diary 72,h2
Hello! Welcome to our Dev Diaries. This is where we give you a peek behind the curtain to see how we’re making MELDapp even better. So…,h3
RootData 2023 Web3 Research Report and Annual Rankings,h2
Author: Rootdata,h3
The World’s Most Important Company: Worth Risking Peace!,h2
How to stake LAVITA through Theta Mobile Wallets,h2
"Staking LAVITA tokens helps secure and govern the Lavita Theta subchain and plays a critical role in the governance, decentralization and…",h3
Can blockchain be a solution to the state’s deepening legitimacy problem?,h2
Ethereum 2024 Roadmap Update and Preview of EIP Proposals,h2
Ethereum Roadmap Update,h3
Gitcoin Passport — HAS IT BEGUN?!,h2
Seen the news? zkSync has added a couple of roles to the Guild that can only be obtained by using a Gitcoin Passport and having a certain…,h3
SCF #22 Recap,h2
The Stellar Community Fund (SCF) is an open-application awards program that draws on community input to support developers and startups…,h3
Bluefin Airdrop Guide To Claim Free Crypto Airdrops,h2
The Bluefin Airdrop represents a promotional distribution of Bluefin Network crypto tokens. This event targets existing stakeholders and…,h3
"Revolutionizing Healthcare: The Convergence of AI, Blockchain, and DAOs",h2
"In the corridors of global healthcare, a quiet revolution brews, one that promises to redefine the bedrock of patient trust and system…",h3
Jupiter $JUP Airdrop Eligible Tutorial: How to Get it Now?,h2
zkSync Era Full Guide with Update 200+ Transaction,h2
Now Zksync era back 40% gas fee. suppose if you see gas 1$ but they take only .6$,h3
What is Warpcast? Should you join this decentralized platform?,h2
"If you can’t read this article because of the firewall, go here to read it for free!",h3
OM Token V2 Migration Step-by-Step Guide,h2
How to migrate your OM tokens in just a few clicks,h3
Orchid token Airdrop — Complete Guide,h2
enter airdrop page,h3
The GainsPad Lottery & Whitelist System 🎰,h2
"When projects get super hyped, jumping in can be tough because everyone wants a piece of the cake.",h3
Treasure Airdrop Tutorial: CLAIM 250 IN (MAGIC) FOR ALL!,h2
PixelRealm Roadmap 2024,h2
A recap of our year and what’s ahead for 2024.,h3
SwapMode: Revolutionizing DeFi with Concentrated Liquidity and Real Yield on Mode Network,h2
"The decentralized finance (DeFi) landscape is evolving, and SwapMode is at the forefront of this transformation. As the premier…",h3
Powerledger $POWR Airdrop Strategies: Optimizing Your Rewards,h2
Exploring Powerledger $POWR Airdrop through DappRadar? Uncover the process of obtaining Powerledger $POWR airdrops and the advantages it…,h3
Winee3’s Closed Alpha Testing and Rewards Program!,h2
We are thrilled to announce an overwhelming response to our early registration call for Winee3’s closed alpha testing. In just one week…,h3
Unveiling the Mechanics of Aeroscraper and Neptune Finance,h2
Development Plans for Sloco.Bet with KAI,h2
[한국어],h3
10+ secret sites to get instant-crypto online without risking anything.,h2
HOW TO MIGRATE YOUR TOKENS TO MEGALAND V2?,h2
"Megaland migration has started and, except for MEXC holders, all holders should migrate their tokens via the official migration platform.",h3
🌟 January in Review: Unveiling a Tapestry of Impact!** 🌍,h2
Run your Aleo Node,h2
"This is a step-by-step guide to build and deploy easily your Aleo node in 3 minutes, with no need for code knowledge !",h3
Bitcoin Gold $BTG Airdrop Qualifying Comprehensive Tutorial: How to Get it Now?,h2
QUAI Network: Energy. Based. Money. For the 21st Century.,h2
"Quai Network is an EVM compatible, highly scalable and secure Layer 1 blockchain, designed for fast, low cost, high-throughput…",h3
Echoes of the Past: The Skeuomorphic Journey from Early Internet to Web3’s Metaverse,h2
"In the dynamic realm of technology, certain design philosophies recur, mirroring trends from previous eras. One such enduring concept is…",h3
2023 Recap & Q1/2024 Roadmap,h2
What happened in 2023 and what’s coming in 2024.,h3
PixelMon token Airdrop — Strategie,h2
Tezos $XTZ token Airdrop — Full Tutorial,h2
🤑 Make MILLIONS with this Lowcap 100X Altcoin? 🚀,h2
Adding potential cryptocurrencies to your portfolio before the market takes off is probably why you’re reading this post. Getting into an…,h3
"Blockchain is a booming technology and a buzzword among all techies nowadays, so let’s dive in and…",h2
Smart Contracts are a set of instructions executed in a decentralized way without the need for a centralized or third-party intermediary.,h3
Unmasking the mystery: can you really track Bitcoin ?,h2
Cryptocurrency,h3
Chrono.tech’s $TIME: A Token Traversing the Landscape of Recruitment and DeFi,h2
The $TIME token,h3
Welcome to the LimoNation App!,h2
"Hi, and welcome to Limoverse!",h3
edeXa: Own a piece of the blockchain future!,h2
edeXa is blazing a trail in blockchain by inviting you to join their exclusive presale of the EDX token. Early participation doesn’t just…,h3
Starcoin Testnet Mining Tutorial,h2
"To facilitate the user experience on the Starcoin 2.0 Testnet, we have created a simple and user-friendly mining program. It allows users…",h3
Future of Finance: A Glimpse Beyond the Horizon,h2
"The financial landscape is undergoing a metamorphosis. As we stand at the precipice of a technological revolution, driven by innovation and…",h3
Navigating the Aleo Blockchain: A Comprehensive Guide to Interaction and its Remarkable Funding…,h2
Several whispers from Aleo team and its ambassadors and are pointing to a possible launch of Aleo’s Token this Q1 2024 some say it’s…,h3
Charting a Greener Course: Building a Sustainable Crypto Future,h2
"Cryptocurrencies, born amidst promises of democratizing finance and revolutionizing transactions, have faced increasing scrutiny regarding…",h3
Shell.Trade Ambassador Program,h2
"Earn up to 5000$/month, be a Shell Ambassador, (DYOR)",h3
The Dawn Of A New Economy Part #1,h2
"October 26, 2021by Caleb",h3
Solana Airdrop: Claim Free $SOL Tokens Instantly,h2
Solana airdrops are events where new tokens are distributed free to Solana wallet holders. These giveaways can incentivize participation or…,h3
5 red flags to watch out for in Phishing attacks,h2
A recent report by web3 security firm Scam Sniffer estimates that phishing scams stole around $300 million worth of cryptocurrencies in…,h3
"I don’t care if I get sandwiched, bigger things are coming to MEV",h2
The inner workings of MEV and how the industry is shifting,h3
MEV Bots 101: What are MEV Bots and How are They Making Millions?,h2
The Gray Area of DeFi: How Bots Are Front-Running Crypto Investors and Squeezing Out Profits,h3
Manta Network Airdrop Claim Free Crypto Airdrops!,h2
The Manta Airdrop refers to the distribution of tokens to early adopters of the Manta Network. Eligible participants receive these tokens…,h3
A wallet that rewards you simply for using it.,h2
Yesterday marked the beginning of a new airdrop initiative aimed at increasing user adoption whilst rewarding StrikeX Wallet users simply…,h3
How NFTs and Smart Contracts are Shaping the DeFi Ecosystem,h2
"The decentralized finance (DeFi) landscape is a whirlwind of innovation. At its core, smart contracts, self-executing code on blockchains…",h3
SingularityNET Latest Ecosystem Updates: January 2024,h2
"The latest technology, blockchain, and decentralized AI updates include BGI24 and BGI Challenge, Supervisory Council Workshops, Deep Fund…",h3
Tokenization 2.0: Unveiling the ERC-6960 Dual Layer Token Standard,h2
"The world of tokenization, transforming real-world assets into tradable digital tokens, has seen explosive growth in recent years. However…",h3
"Symphony: Revolutionizing DeFi with Stability, Decentralization, and Trust",h2
Introduction:,h3
Farcaster — HOLD ON TO YOUR HATS FOR SOME SERIOUS FOMO!,h2
"I’m confident that most of you have heard about Farcaster, at least because it’s been covered quite extensively all over X. However, many…",h3
🌍DYDX Airdrop,h2
Step-By-Step Guide How to Claim dYdX Airdrop,h3
Beyond the Hype: Are NFTs Still a Thing in 2024?,h2
"Non-fungible tokens (NFTs) exploded onto the scene in 2021, captivating the world with dizzying headlines and eye-watering price tags…",h3
Is $NEO dead? No. Is it failing? Yes. Will it finally wake up? Perhaps.,h2
"Neo is one of the oldest blockchains and one of the first to support smart-contracts. However, you will find many people arguing that it's…",h3
"Charting Our Course: Foreon Network’s Updated Roadmap, Tokenomics & Vesting Schedule",h2
"Today, we’re excited to share our progress, our journey so far, and what lies ahead.",h3
Solana Crypto Airdrops Claim Free $SOL Free Tokens,h2
DATA OWNERSHIP PROTOCOL [ DOP ],h2
Official binance confirmed this airdrop,h3
Arbitrum Crypto Airdrop: Earn $ARB Tokens Free!,h2
The Arbitrum airdrop refers to the distribution of free tokens to the users of the Arbitrum network. It rewards early adopters and…,h3
What is Restaking?,h2
This is the second piece in our educational series on staking and its significance to the blockchain ecosystem. It builds off of our…,h3
Arbitrum Airdrop Check Eligibility Claim $ARB,h2
The Arbitrum airdrop distribution of free tokens to the users of the Arbitrum network. It rewards early adopters and participants within…,h3
Building a Blockchain from Scratch with Python!,h2
Learn the Basics of Blockchain Technology and Create Your Own Blockchain in Python with Step-by-Step Instructions.,h3
BeraChain $BERA Airdrop Full Tutorial: Claim 100$ Now!,h2
Vue 3 Composition API: Basics and Patterns,h2
"This blog is a part of our “Engineering at Arcana” series, and is written by our Frontend Developer Shrinath Prabhu.",h3
Discover the Future with Sui: Empowering Possibilities,h2
