Title,Tag
"Recommended stories in ""Blockchain""",h2
Gelios Thread Contest: Share Your Knowledge and Win! 🏆,h2
Let’s raise awareness about Gelios!,h3
Implementing a Blockchain in Rust,h2
"This article provides a step-by-step breakdown of implementing a basic blockchain in Rust, from the initial setup of the block structure…",h3
🌍Avail: Deploy an Appchain using Madara & Karnot,h2
Clash of Nodes Testnet,h3
$5IRE Airdrop Update: Part 1,h2
"As we bid farewell to the first phase of the airdrop campaign, dedicated just for early supporters of the 5ire ecosystem, has been nothing…",h3
In Search of Lost Keys,h2
"This is a “blast from the past” article, which I think is appropriate, given that the New Year is nearly upon us. Satoshi Nakamoto launched…",h3
This Trading Strategy Could Make You Rich: How to Make Money with Newly Listed Coins on Binance,h2
"Every week, new tokens are listed on various crypto trading platforms, offering opportunities to those interested in day trading or swing…",h3
"When you accidentally 50x your rent money in one day, thanks to AI & Elon Musk.",h2
"If there’s one thing that’s certain in crypto, it’s that there is a large degree of information asymmetry. Recent life-changing coins like…",h3
"10 Highlights From Messari’s Epic ‘Crypto Theses 2024"" — Part 1",h2
"Published December 19, and clocking in at 193 pages (a 23% increase from 2023’s Theses), Messari’s “Crypto Theses 2024” is (IMHO) the…",h3
$PRYZM Airdrop Step-by-Step Guide: How to qualify for $PRYZM Airdrop by Airdrop Ninja,h2
"Before going into this article, ensure to yourself some good by adding this article to your list for future references.",h3
Using the blockchain to verify email addresses sounds pretty smart,h2
"Blockchain is a logical, easy-to-use solution for verifying the identity of an email address. Which is why I like the idea of using Proton…",h3
January roundup & February preview,h2
"January was full of momentum and phenomenal updates for Cryptopia investors, bringing with it many new members, a series of exciting…",h3
Geopoliticus Adult Watching the Death of the Old Man,h2
On the contemporary political situation(s) and their implications for the future,h3
Let’s see if our sandwich bot really works,h2
Do we have an edge in the MEV market,h3
Web3’s Failure Was Predicted By Its Marketing,h2
Billions of marketing dollars sometimes aren’t enough to cause a vibe shift.,h3
Spacemesh $SMH (The People’s Coin),h2
Spacemesh Exploration,h3
BalanceAI — Weekly Report,h2
"Weekly Report — February 11, 2024",h3
NFTs: No Future Tokens,h2
"In the least surprising news ever, 95% of NFT projects are worthless",h3
Run your Berachain Node,h2
In 5 minutes !,h3
"No, You Shouldn’t Trade Your Eyeballs For Crypto",h2
What could possibly go wrong?,h3
🌍Avail: Deploying Your First Dymension RollApp (Pt. 1),h2
"Four weeks ago, we successfully set up our Avail node. Unfortunately, we missed the opportunity to become an official validator, as the…",h3
StoryFire Ambassador Program: Leaderboard-Based Rewards,h2
Overview of the Ambassador Program:,h3
The Internet Is Still Wide Open,h2
The internet is far more open and creative than is often portrayed. It’s overflowing in fact and that’s wonderful. Here’s why.,h3
The Bera Era Has Begun,h2
"The happy day has arrived. Rejoice, one and all, because if you’re reading this, Berachain Public Testnet “Artio” is live.",h3
Dimecoin Staking Explained | Dimecoin Network,h2
Overview,h3
Decentralized Dispute Resolution,h2
From Courtrooms to The Blockchain: DDR at the intersection of decentralization and justice,h3
PATCH NOTS 3.0 RUBXZ POSH PROTOCOL 💡🚀,h2
Patch Note 1.3,h3
It ain’t what you think it’s the language that you think in,h2
"A few weeks ago I was talking to Michal, who is a Lead Security Engineer over at Resonance Security. We were planning to discuss…",h3
Saga Mainnet Technical Launch Plan,h2
Hello Saganauts!,h3
Secure Your Tokens: Bitcoin Cash $BCH Airdrop Now Open,h2
Looking to get Bitcoin Cash $BCH Airdrop through DappRadar? Learn how to secure Bitcoin Cash $BCH airdrops with this comprehensive guide…,h3
Towards Defensible Infinite Scale,h2
The Rise of Protocol-Based Models,h3
stTIA Expansion: Stride Expands to the Modular Ecosystem with Hyperlane,h2
"We’re excited to announce that Stride, the premier liquid staking hub, is collaborating with Hyperlane to expand stTIA to the modular…",h3
"Syscoin, SuperDapp and the AI Revolution",h2
SYS Labs is massively capitalising on the explosive growth of AI. Find out in the article below what they’re doing and why it’s BIG.,h3
Web3 Series: The Story of Blockchain,h2
Why it’s important to understand this growing phenomenon that is starting to upend the business world.,h3
Earn3 V2 —  leveling up Crypto Airdrop hunting 🪂,h2
A new portal for a more efficient search for Crypto Airdrops has been launched. Earn3 V2 is FREE to use! 🎉 Let's find out 👇,h3
How to mint NFTs programmatically,h2
"In this article, you’ll learn about how you can mint NFTs programmatically using Alchemy and Pinata with 0 Solidity knowledge.",h3
DePIN: The Next Big Crypto Narrative?,h2
The cryptocurrency industry and blockchains as a whole are still in their infancy and looking for true product-market fit. Though we’ve…,h3
HEROES OF MAVIA Airdrop eligibility — Tutorial,h2
The Pixelated Party Is Over for NFTs,h2
The technology is Now Fully Toxic,h3
Crypto will explode! Here is the reason.,h2
Today is all about the next big things coming our way in the crypto market.,h3
Ride the Hottest Crypto Narratives with this Strategy (my portfolio included)!,h2
"With over 10,000 tokens to invest in and everyone telling you to get into their project, here's an easy plan to capitalize on what you…",h3
What is Privacy in Web3?,h2
An Exploration of the Different Conceptions and Approaches to Privacy in Web3,h3
🌍Mangata Finance: A Step-by-Step Guide to Node Setup,h2
Connecting Ecosystems: Mangata Finance’s Vision for Omnichain Liquidity,h3
$MAVIA TOKEN Airdrop — Biggest Airdrop is going now!,h2
NFTs Finally Have a Use-Case: A Sewer Game With Bad Poop Jokes,h2
Have money to flush down the toilet? This one is for you,h3
3 Unique Crypto Projects You've Got To Check Out,h2
"While influencers are all pumping their bags, I will pump my bags about some projects that are breaking the mold.",h3
"🔥 Join $MOCA 100% Confirmed Airdrop | Must Join this, Backed by Animoca & OKX 🪂",h2
Let's Start the Blog 👇,h3
"Account abstraction, the new shiny object in crypto",h2
But are the advantages worth the tradeoffs?,h3
AIT joins the Bittensor Neural Network shaping Decentralized ML,h2
I. Bittensor’s Overview,h3
Free Resources to Learn Blockchain DeFi Development,h2
"Diving into blockchain and DeFi development is exciting, yet the sheer volume of resources can be overwhelming. We all want to cut through…",h3
Hands-On Implementation of the Raft Algorithm With TypeScript,h2
A powerful tool for achieving consensus in a distributed system,h3
How to Setup a Taiko Node and Holesky RPC Client,h2
"This guide, will cover the configuration of a freshly installed VPS server as an Ethereum Holesky RPC client. Once the Holesky RPC client…",h3
Implementation of Merkle Trees and Inclusion proofs,h2
How blockchains store transactions data? How are blockchains immutable?,h3
Going back to the roots. A Crypto 2022 sum up and thoughts for the future,h2
"In 1981, Odyssey released “Going back to my roots”. I’m literally sitting here and listening to it, while trying to figure out how to sum…",h3
RMM V3 Public launch,h2
"After many months of work, we are proud to disclose the official launch of the RMM V3.",h3
DePIN: DATS Project’s Cyber Security Solutions and Benefits to Society,h2
"In today’s digital age, there are many cyber attacks and security is becoming an increasing concern. The increase in data leaks, malicious…",h3
"Binance’s Billions are Backed, but You’re Probably Asking the Wrong Question",h2
"The crypto industry is obsessed with figuring out if digital assets are actually backed by anything, but they should be careful what they…",h3
Understanding iBGT: The Future of Liquid Staking on Berachain,h2
Berachain is an EVM-compatible Layer 1 blockchain that features a unique Proof-of-Liquidity (PoL) sybil resistance mechanism. Designed to…,h3
"Bitcoin to $55000.. (RJ’s Newsletter — February 11, 2023)",h2
Stay ahead of the markets with this week’s newsletter!,h3
Why are there so many Web3 startups?,h2
"This week, Pitchbook published their latest Emerging Tech Indicator (ETI) report which tracks early stage investment activity amongst the…",h3
Bitcoin Basics: Chapter 1,h2
Financial Chaos,h3
[GnoDesk] Week 1 of Feb 2024,h2
Gnoland ecosystem updates for the 1st Week of February,h3
Rational optimism for crypto,h2
"On March 10th, 2000, the NASDAQ Composite Index hit an all time high of 5,048, signaling the peak of the dotcom bubble after growing 6x…",h3
LayerZero V2 Deep Dive,h2
"Everything you need to know about V2: architecture, trust assumptions, tx lifecycle, and more…",h3
USM Metaverse now available on Magic Square,h2
"RACA is pleased to announce that USM Metaverse is now available at Magic Square, an immersive Discovery & Engagement Platform for the Web3…",h3
Learn Blockchains by Building One,h2
The fastest way to learn how Blockchains work is to build one,h3
Monolithic VS Modular,h2
"This is the second article in the Fuelet series about modular blockchains, Fuel specifically. Read the intro to the modular blockchains…",h3
Urgent : Join Synth Early Adopter ending in Few Hours,h2
Web 3.0 for B2B: Using UX Research to Inform Blockchain Solutions,h2
The B2B industry is likely going to be impacted first by Blockchain applications. Here’s how to use UX research and inform the right…,h3
The Phoenix Protocol: An Exciting New Quest for GMEE Token Holders,h2
"A thrilling new adventure awaits GMEE token holders, with epic quests and tons of rewards on offer for our community!",h3
Founder’s Node Governance Proposal: Referral Incentive System for Ecosystem Usage,h2
"In the spirit of fostering innovation and collaboration within the Gala Founders Node Ecosystem, a new proposal is presented for…",h3
The Bar at the Edge of the Metaverse,h2
"What We Built, What I Learned, and What’s Next for Fin’s Beach Bar and Back Patio",h3
Earn native yields on layer 2 with Blast (Testnet and Early Access),h2
"The founder of Blur, Pacman, has recently launched Blast, a layer 2 solution born out of the need to ensure that yields on ETH and…",h3
MonoSwap Testnet (Blast Ecosystem),h2
hiring the best one blockchain network 2024,h3
The Crypto Winter Is About to Become a Crypto Ice Age,h2
"As another big player collapses, trust is being eroded",h3
Ethereum Price Prediction for 2024,h2
ETH Price Prediction,h3
How Interchain are Building an Internet of Blockchains,h2
What I learned from my discussion with Interchain’s Managing Director Maria Gomez.,h3
"The Collapse of FTX Is Not The Fault of Cryptocurrency, But Bad Business Models",h2
Fraud is Fraud — No Matter If Done Through Cryptocurrencies or Fiat Currency,h3
The Unblock Manifesto,h2
Correcting the Innovation Mindset in Web3,h3
Puri — A Brief Guide,h2
A quick overview of how the Puri Project came about and currently announced plans,h3
The Blockchain Scalability Problem & the Race for Visa-Like Transaction Speed,h2
"Yes, blockchain has a scalability problem. Here’s what it is, and here’s what people are doing to solve it.",h3
7 Amazing Crypto Websites and Apps for Beginner Investors: Number 5 Will Blow Your Mind,h2
"Hello there! Whether you’re an investor or a trader, there are several websites and mobile applications that can make your crypto journey…",h3
Heroes of Mavia (MAVIA) Token Heroes of Mavia (MAVIA) Airdrop Full Guide: How to claim Coin airdrop?,h2
Why Decentralization Matters,h2
We’ve forgotten there’s a better way to build internet services,h3
ZkSync Airdrop Leak: Libertas Omnibus NFT Usecase unveiled?,h2
Potential leaks indicate that ZkSync is planning something special. They are adding a fun twist to their Airdrop by creating an entire…,h3
The Master Guide on How to Buy Crypto,h2
Discover 6 methods to purchase crypto & learn everything you need to know about them.,h3
The resolution of the Bitcoin experiment,h2
"I’ve spent more than 5 years being a Bitcoin developer. The software I’ve written has been used by millions of users, hundreds of…",h3
Berachain Testnet — HONEY are you ready?,h2
"HONEY, are you ready to embark on a bear-y special journey?",h3
VeChain $VET Airdrop Eligible Step-by-step Guide: How to claim?,h2
"Logan Paul’s NFT Collection, Once Worth $2.8 Million, Has Lost 70% Of Its Value",h2
He’s now another owner of NFTs “worth essentially nothing”,h3
Breaking Boundaries: LumiStake’s Latest Upgrades Reshape the Staking Landscape,h2
By ShareNews.io Editorial Team,h3
Morphy’s Origins and Aspirations,h2
Morphy is more than just a symbol; he represents the creative and adventurous spirit of Morph.,h3
The Metaverse Will Be Less Anonymous Than You Think,h2
"Cookies and advertisers are common place in the web as we know it, but in the metaverse brands can look into your soul.",h3
Exploring the Potential of $TIME Token,h2
Image Credit: Bushra,h3
I was a crazy crypto miner,h2
A true story of how I went all-in mining cryptocurrencies during the first gold rush of Bitcoin in 2013.,h3
How The GainsPad Tier System Works ❓,h2
"You’ll need to stake at least 1,000 $GAINS for a chance to invest in one of our IDOs.",h3
How to get Your Power Ledger $POWR Airdrop: Guide,h2
That Time We Burned Down Players’ Houses in Ultima Online,h2
"Ultima Online is celebrating its 25th anniversary! You know what that means, right? Story time!",h3
V2 Use Case: Clusters and LayerZero,h2
All the chains. All your wallets. One Name. Now live on V2.,h3
Blockchain Beyond Bitcoin: The Next Generation of Applications,h2
"Exploring blockchain’s vast potential beyond Bitcoin, from finance to healthcare and energy, unlocking revolutionary applications",h3
The Crypto Correction Shows the Market Working,h2
"By Jamil N. Jaffer, NSI Founder and Executive Director, and John Poulson, NSI Public Policy and Government Relations Manager",h3
DREX for gringos,h2
Brazil’s money scene is getting a massive shakeup! The Central Bank of Brazil’s throwing a curveball with a new thing called the DREX…,h3
Bringing the Real World to Your Blockchain with Redstone Oracles,h2
Introduction to the Magic of Oracles,h3
Can Life Exist on the Blockchain?,h2
"By leveraging Web3 technology, it is now possible for the first time ever to digitally recreate the conditions necessary for the process of…",h3
What is Bitcoin Halving?,h2
How Halving Works and Why It’s Needed,h3
ColdStack Partners With Inery Blockchain,h2
Dear community members! We are thrilled to announce an exciting partnership with Inery Blockchain!,h3
"I’m not a robot (but, are you?)",h2
"The case for authenticating humans, reclaiming our identities, and defending against the swarm of coming bots. Can web5 be the answer?",h3
Crypto Retirement Plan: January Update,h2
At the end of 2023 I had shared my strategy for retiring with crypto in the coming 2 years.,h3
How to claim the XDBee Game HONEY Airdrop: A Step-by-Step Guide to enabling Trustline,h2
"In the ever-evolving landscape of blockchain and cryptocurrencies, unique opportunities frequently emerge, captivating the community. One…",h3
How to make decentralized apps (dApps) more user-friendly,h2
"I feel for Celsius, Three Arrows, Babel Finance and whoever the next floater happens to be.",h3
A Beginners Guide to Web3,h2
"Web3, simply put, is the next generation of the internet. It’s a departure from the way we’re used to experiencing the online world. Unlike…",h3
How to Stake and Auto-compound of Dymension with Yieldmos,h2
Table of contents,h3
DeSoc’s Dark Heart,h2
"DeSoc, for all its talk, has a very dark element as proposed",h3
The Launch of RentSpace’s NFT Collection: Minimalistic Villas,h2
"RentSpace, the next-generation property rental platform, was looking to get into the NFT space to offer a new digital asset for community…",h3
Unlock Your Future In Crypto With Jobfy. Where Innovation Meets Opportunity !,h2
Pioneering Decentralized Employment Solutions in Crypto and Blockchain. Revolutionize Your Career Path with Enhanced Transparency and…,h3
Is Twitter a public ledger?,h2
"Yes, yes it is and that may be why Musk wants it",h3
Five Reasons Why Solana Will Be More Profitable Than Ethereum,h2
"…even though I still prefer ETH, at least for now.",h3
Toncoin $TON Airdrop Insider: Unlocking the Hidden Potential of Crypto,h2
"Want to get this Toncoin $TON Airdrop through DappRadar? If so, you’re in the right place. As the popularity of airdrops continues to soar…",h3
Adam Neumann Is Here to Elevate The World’s Blockchains,h2
The comeback tour starts with “Goddess Nature Tokens”,h3
Top 6 Tokens to Make You More than a Million Dollars in 2024.,h2
"In the ever-evolving world of cryptocurrency, tales of astronomical gains and life-changing investments echo through the years. As we stand…",h3
Unlocking the Future of Cryptocurrency Prediction: A Federated Learning Revolution with Federal AI,h2
"Enter federated learning (FL), a distributed machine learning strategy that is poised to revolutionize cryptocurrency price prediction.",h3
The Myth of Renewable Bitcoin,h2
Why pushing Bitcoin towards renewables is unlikely to help anything,h3
「EN」ABCDE: Why We Invest in Bitmap.tech,h2
February 3rd 2024 | BMAN,h3
Introducing $SMAX,h2
Solana Max: Programmed for Max Levels of Euphoria,h3
The TerraUSD Stablecoin Lunacy Explained,h2
"If it sounds too good to be true, it probably is too good to be true",h3
How to Create an On-Chain Farcaster Frame,h2
Turn your cast into a decentralized interactive app,h3
Meet the Ethernity Team: Jakub Pyzik,h2
We want you to get to know us!,h3
Why Economists Don’t Like Bitcoin (Part II),h2
Let’s take a look at some good reasons,h3
Easy Ways to make Money Online with Cloud Mining ($1200+ per day). *SunMiner Withdrawal proof*,h2
"Hey, all you must now know from the title of this article is that I will talk about or show you the withdrawal proof of the SunMiner cloud…",h3
Meet the TERFs,h2
"Have you ever wondered, what exactly *is* a TERF? What is a gender-critical? The TERF rabbit hole goes much deeper than a controversial…",h3
Why blockchain and Web3 user interfaces will suck for a while,h2
How Web 2.0 grumpiness + Web3 hubris are contributing to terrible user experiences on the cutting edge of tech.,h3
Blockchain : a Software Architecture perspective,h2
Blockchain has been a buzzword for some time now. The topic can generate strong reactions. I think it is because it solves the Byzantine…,h3
Heroes of Mavia Crypto Qualify Instruction: Get airdrop!,h2
“Smart Contracts” Are Way Dumber Than You Think,h2
Uncovering the bad engineering behind ‘smart’,h3
The AGIX Token: Enabling anyone to participate in the future of AI,h2
SingularityNET’s AGIX utility and governance token provides an opportunity for anyone to shape and be rewarded by the growing AI landscape.,h3
Data. Onchained.,h2
"MELD is a self-sustaining L1 blockchain solution with a novel node-incentives model, a UX-focused block explorer, multiple oracles, and…",h3
"Jack Dorsey’s First-Tweet NFT, Listed at $48 Million, Has Lost 99% Of Its Value",h2
It’s all buying and selling for the sake of buying and selling,h3
Why Crypto Games Will Never Be A Thing,h2
"Emerging technologies: VR/XR, Artificial Intelligence, Metaverse, Blockchain…",h3
CheckDot — DevNet,h2
CheckDot — DevNet : An unexpected journey,h3
Modern Grifters and The Golden Age of Fraud,h2
Crypto is creating the next batch of unhinged Netflix crime series,h3
🌍Evernode: Become a Pioneering Host,h2
What is Evernode? — An Overview,h3
$ALT TOKEN Airdrop — Get Free $ALT!,h2
Six Ideas to Rescue Higher Education,h2
Nimbyism is killing opportunities for younger folks. Here’s how we could fix it.,h3
Monaco's Predictive Markets Protocol: A Deep Dive,h2
What are Play-to-Earn(P2E) games?,h2
Photo by Pixabay,h3
Why Buying Million-Dollar Digital Real Estate Does Not Make Sense,h2
"Despite a boom in digital real estate, buying digital land for millions of $$ doesn’t make sense to me when there is infinite digital…",h3
"Redbelly Community Program: How it works, and how you can earn RBNT coins.",h2
Introduction,h3
Web3 as a Piece of Cake: L2 vs Subnets,h2
"There was a princess who asked, “What are the best Avalanche Layer 2 Solutions?” she can’t no longer ask questions because she was killed…",h3
Understanding Zero-Knowledge Proofs Through the Source Code of Tornado Cash,h2
Dive into the world of smart contracts with Zero-knowledge proof,h3
These Top DePIN projects Will Bring Web3 Mainstream in 2024,h2
"The DePIN, or Decentralized Infrastructure Network, has become one of the hottest trends in Web3 this year while, after the collapse of…",h3
Unlock Free Terra Classic $LUNC: Airdrop Claiming Strategy Revealed,h2
"Want to get this Terra Classic $LUNC Airdrop through DappRadar? If so, you’re in the right place. As the popularity of airdrops continues…",h3
NFTs Aren’t As Stupid As You Think,h2
"They’re much, much stupider — investing is like that",h3
Top 6 Cryptos With the Best Potential in 2024💵💵,h2
"As the cryptocurrency market evolves in 2024, new investment opportunities emerge, creating excitement among investors. As today the…",h3
ERC-404: Ethereum Blockchains Path to NFT Liquidity and Accessibility,h2
"Ethereum, the leading smart contract platform, has been at the forefront of this innovation, providing a fertile ground for the creation of…",h3
The Great Blockchain of Being,h2
What the origin story of the Reformation tells us about the future of cryptocurrency and blockchain technology.,h3
Top 6 Legit Sites To Get Paid Udemy Courses For Free,h2
Free Udemy Courses download,h3
3 Airdrops to Claim Now 🪂🪂🪂,h2
"The crypto market is in correction 🔻, but Airdrops are very active 🔺. Information about three actual Airdrops. All three became available…",h3
The First Milestone for COTI V2 Development has been Achieved!,h2
Written by Dr. Avishay Yanai and Dr. Nir Haloani,h3
Jupiter Solana Airdrop Q&A: Everything You Need to Know!,h2
"With the buzz around Jupiter Solana airdrop, there’s things you need to know. We’ve found answers to the most commonly asked questions.",h3
The combination of technologies promoted by RACA has the potential to impact the society,h2
🌍Exploring Palau’s Digital Residency Program,h2
The Perks of Being a Digital Resident in Palau,h3
EigenLayer Airdrop: How to get 100$ today?,h2
Retik Finance and RenQ Finance: A Tale of Two Scams,h2
"The Retik Finance team just came out with a response to a few articles that questioned the token’s legitimacy. In this response, they refer…",h3
Cardano $ADA token Airdrop — Comprehensive Tutorial,h2
Unveiling The ApeBond Launchpad,h2
We are thrilled to announce a groundbreaking development in the ApeBond ecosystem: the introduction of our very own Launchpad. This…,h3
2023: A Year of Technological Progress,h2
The Accumulate Core Committee is pleased to present the 2023 review of the Accumulate Protocol.,h3
Awesome On-Chain Investigations HandBook 2.0,h2
"Blockchain technology has unlocked a new era of digital innovation, offering unprecedented opportunities and possibilities. However, the…",h3
Get your DYMENSION $DYM Airdrop: Complete Tutorial,h2
Morph Testnet Goes Live: Join Us in Setting New Standards in Consumer-Centric Blockchain!,h2
"We are thrilled to announce the launch of Morph’s Public Testnet, a transformative Layer 2 blockchain solution designed to redefine the…",h3
Intro To Smart Contract Auditing,h2
Embracing the Future of Gaming: Why Solana is Your Next Destination for Blockchain Game Development,h2
"Hey there, fellow game developers and blockchain enthusiasts! 🙌 🎮",h3
"Be Fast!! 0$-10,000$ with the Testnet Blast Airdrop!",h2
"In this environment, you need to be very careful with links and fake websites.",h3
What Are ERC-20 Tokens on the Ethereum Network?,h2
"In 2014, Vitalik Buterin launched Ethereum, setting it up as an open-source framework dedicated to the development of decentralized…",h3
SoDark Platform Intro!,h2
The first tool for Atlas3 & Subber & Alphabot. We’ve created a third-party platform for you to manage all your Giveaways on your Discord…,h3
Heroes of Mavia $MAVIA Airdrop claim — Full guide,h2
Merkle Trade Incentives Overview. Trading Seasons,h2
TLDR;,h3
The Staking and Rewards Guide for the Work X Genesis NFT,h2
Nibiru Chain Airdrop — Massive Airdrop is now Live!,h2
"Swan Chain, a Layer-2 OP Superchain Built for AI Computing",h2
Artificial intelligence (AI) and blockchain are two of the most disruptive and transformative technologies of our time. Both fields have…,h3
EOS $EOS Airdrop Strategy: Claim 500$ Today!,h2
Curious about obtaining the EOS $EOS Airdrop using DappRadar? Delve into the process of acquiring EOS $EOS airdrops and their advantages…,h3
"Koii Node: Featured in Binance, Potential 500$ Passive Income, Tier 1 Exchanges, Mainnet Q2",h2
"Put your computer to work, get paid and support organizations you care about",h3
